{
  "task_id": "TECH-6969",
  "task_spec_stub": "\n\n## §Plan Digest\n\n### §Goal\n\nVerify `tools/seams/author-plan-digest/output.schema.json` matches the structured output the engine emits when `seam.author-plan-digest` runs live; execute one end-to-end `npm run recipe:run -- stage-authoring` against a real Task input; confirm `task_spec_section_write` MCP fires from the engine and writes the §Plan Digest body to `ia_task_spec_history`.\n\n### §Acceptance\n\n- One real recipe run logged under `ia/state/recipe-runs/{run_id}/audit.jsonl` carrying step `seam.author-plan-digest` invocation event + emit event with output keys = {goal, acceptance, pending_decisions, implementer_latitude, work_items, test_blueprint, invariants_and_gate}.\n- `task_spec_section_write` event present in same audit.jsonl with `task_id` matching the input Task and `section: \"§Plan Digest\"`.\n- DB row in `ia_task_spec_history` for that `task_id` with `change_reason` carrying `recipe-runner` or `seam.author-plan-digest`; `body` opens with `## §Plan Digest`.\n- Output schema validation passes — engine emit shape passes `Ajv.validate(output.schema.json, payload)` with no extra/missing keys.\n- `npm run test:recipe-engine` exit 0 after the run.\n\n### §Pending Decisions\n\n- live-dispatch input source: choice = use TECH-6968's own §Plan Digest as the dogfood input (recipe authors a §Plan Digest about authoring a §Plan Digest) — rationale: keeps Section-A self-contained; closes the dogfood loop within Stage 2.2.\n- output schema mismatch handling: choice = treat schema as authoritative; engine emit must conform — fix engine, not schema — rationale: schema is the seam contract; consumers (this skill) rely on the keys.\n- audit.jsonl event taxonomy: choice = reuse existing `step_start` / `step_emit` / `mcp_call` event names from `tools/recipe-engine/src/` runner — rationale: existing audit consumers (`ia/state/recipe-runs/000e14ae63f09e45/audit.jsonl` sample) already parse those names.\n- task_id selection: choice = use a low-impact filed Task already in DB (e.g. cycle TECH-6969 or a sandbox Task) — rationale: avoid corrupting tasks owned by other Stages.\n- failure-mode escalation: choice = on schema validation fail OR `task_spec_section_write` not invoked, halt run, write `escalation` event to audit.jsonl, exit non-zero — rationale: lets `validate:recipe-drift` distinguish honest failure from skipped.\n\n### §Implementer Latitude\n\n- May add a debug flag (`--emit-trace`) to recipe CLI for richer audit logging during this verification.\n- May inject a temp test-only seam input fixture under `tools/recipe-engine/__fixtures__/stage-authoring/` if real Task input causes side effects.\n- Free to wrap `task_spec_section_write` MCP call in a dry-run guard for the first iteration (gated by env flag) before flipping to live write.\n\n### §Work Items\n\n- tools/recipe-engine/src/cli.ts: confirm/extend recipe loader to handle `stage-authoring.yaml` shape from TECH-6968 (no new file unless missing).\n- tools/recipe-engine/src/seam-runner.ts (or equivalent): wire `seam.author-plan-digest` dispatch path; ensure structured output is JSON-validated against the seam schema before `task_spec_section_write` fires.\n- tools/seams/author-plan-digest/output.schema.json: review only; edit only if engine emit reveals genuine drift (rationale documented in commit).\n- tools/seams/author-plan-digest/input.schema.json: review only; engine input must conform.\n- ia/state/recipe-runs/{new_run_id}/audit.jsonl: produced by the run; no manual edit.\n- tools/recipe-engine/__fixtures__/stage-authoring/dogfood-input.json: optional fixture file capturing the live input for replay.\n\n### §Test Blueprint\n\n- `npm run recipe:run -- stage-authoring --task TECH-6969 --emit-trace` → exit 0, audit.jsonl present, schema validation logged.\n- `npm run test:recipe-engine` exit 0.\n- `psql $DATABASE_URL -c \"SELECT task_id, section, change_reason FROM ia_task_spec_history WHERE task_id IN ('TECH-6968','TECH-6969','TECH-6970') ORDER BY id DESC LIMIT 5\"` returns ≥1 row carrying `recipe-runner` change_reason.\n- Schema validation harness: `node -e \"const Ajv = require('ajv'); const a = new Ajv(); const v = a.compile(require('./tools/seams/author-plan-digest/output.schema.json')); console.log(v(samplePayload))\"` returns true.\n\n### §Invariants & Gate\n\ninvariant_touchpoints: seam contract integrity, DB sole source of truth for task spec bodies, recipe audit log completeness.\nvalidator_gate: validate:recipe-drift, test:recipe-engine, validate:master-plan-status.\nescalation_enum: schema_drift, db_unavailable.\n**Gate:** schema validation passes AND audit.jsonl carries `task_spec_section_write` event AND DB write confirmed.\n**STOP:** schema mismatch (engine emit vs output.schema.json) OR `task_spec_section_write` MCP not invoked OR DB row missing.\n",
  "stage_bundle": {
    "master_plan_slug": "recipe-runner-phase-e",
    "stage_id": "2.2",
    "stage_objectives": "Trim `.claude/agents/stage-authoring.md` (448 lines, 1 recipe mention) to recipe-dispatch shell. Wire `seam.author-plan-digest` live dispatch (Phase E.2 dogfood). End-to-end: subagent body invokes `npm run recipe:run -- stage-authoring`; engine fan-outs per-task `seam.author-plan-digest` calls.",
    "stage_exit": "Body ≥60% line drop. Recipe-parity audit clean. `seam.author-plan-digest` returns structured output for ≥1 real run; `task_spec_section_write` invoked from engine. Drift gate green. Token-drop contributes to C2 ≥40% gate."
  },
  "work_items": [],
  "invariants": []
}