{
  "task_id": "TECH-8296",
  "task_spec_stub": "# TECH-8296 — ui-fidelity-review skill sync\n\n> **Issue:** TECH-8296\n> **Status:** Draft\n> **Created:** 2026-04-30\n> **Last updated:** 2026-04-30\n\n## 1. Summary\n\nSync `ui-fidelity-review` skill to generate `.claude/agents/ui-fidelity-review.md` subagent via `npm run skill:sync:all`. Smoke-invoke subagent with placeholder panel ref to confirm dispatch.\n\n## 2. Goals and Non-Goals\n\n### 2.1 Goals\n\n1. `.claude/agents/ui-fidelity-review.md` generated from `ia/skills/ui-fidelity-review/SKILL.md` via `npm run skill:sync:all`.\n2. Subagent invocable (smoke dispatch passes).\n\n### 2.2 Non-Goals (Out of Scope)\n\n1. Panel rebake work — handled in T1.5.2–T1.5.4.\n\n## 7. Implementation Plan\n\n### Phase 1 — skill sync + smoke\n\n- [ ] Run `npm run skill:sync:all`.\n- [ ] Verify `.claude/agents/ui-fidelity-review.md` exists and matches SKILL.md frontmatter.\n- [ ] Smoke invoke subagent with placeholder panel ref; confirm dispatch completes.\n\n## §Plan Digest\n\n_pending — populated by /stage-authoring_\n\n## §Audit\n\n_pending — populated by `/audit` after `/verify-loop` passes._\n\n## §Code Review\n\n_pending — populated by `/code-review`._\n\n## §Code Fix Plan\n\n_pending — populated by `/code-review` only when fixes needed._\n",
  "stage_bundle": {
    "master_plan_slug": "ui-visual-fidelity-layer",
    "stage_id": "1.5",
    "stage_objectives": "Land the agent-led visual fidelity loop + rebake every in-scope panel to new component contracts. `ui-fidelity-review` skill (already drafted under `ia/skills/ui-fidelity-review/`) generated into `.claude/agents/ui-fidelity-review.md` via `npm run skill:sync:all`. Per-panel rollout sequenced per Review-notes SUGGESTION: pause-menu + info-panel first (already smoke-tested in Stage 12 Step 14.5), settings-screen + save-load-screen mid, HUD last. Each panel: regenerate IR via `transcribe:cd-game-ui`, rebake via UiBakeHandler, run conformance bridge, run `ui-fidelity-review` skill against cd-bundle reference. HUD legacy `UnityEngine.UI.Text` migration explicitly OUT of scope — kept on existing surface per `ui-design-system §1.2`. Stage close = all 5 in-scope panels conformance-clean + fidelity-review-clean against cd-bundle.",
    "stage_exit": "- `.claude/agents/ui-fidelity-review.md` generated from `ia/skills/ui-fidelity-review/SKILL.md` via `npm run skill:sync:all`; subagent invocable.\n- pause-menu + info-panel rebaked + conformance-clean + fidelity-review-clean against cd-bundle reference.\n- settings-screen + save-load-screen rebaked + conformance-clean + fidelity-review-clean.\n- HUD rebaked on TMP-only surfaces; legacy `UnityEngine.UI.Text` text-bearing nodes explicitly excluded from fidelity-review scope and noted in Stage closeout digest.\n- `npm run verify:local` green (compile-check + bridge preflight + Editor save/quit + bridge playmode smoke).\n- All 6 visual-contract gaps closed against in-scope panels per exploration §Problem statement."
  },
  "work_items": [],
  "invariants": []
}